ticket,reply,content_score,content_explanation,format_score,format_explanation
"Hi, I'd like to check the shipping status of my order #1234.","Sure, you can check your shipping status on our website. Your package is scheduled for delivery tomorrow.",4.0,Provides correct delivery information but missing a direct link or guidance to the website section for order tracking.,4.5,Professional and well-structured with a proper response flow but could include a slightly more welcoming greeting.
"The product I received is defective. I'd like a refund, please.",We're sorry to hear that. Could you please provide a photo of the defect so we can proceed with the return process?,4.0,"The response is relevant and correct, requesting a photo for the refund process, but lacks specific refund instructions or next steps once the photo is provided.",5.0,"The response is well-structured with a clear apology, request, and professional tone."
I have a question about how to set up my new device. The instructions are not clear.,"Hello, thanks for contacting us. Please go to Settings > Advanced > Device Setup, and follow the steps. Let me know if you need further help.",3.5,The response gives a basic direction but lacks detailed guidance which might be needed if instructions are unclear.,4.5,"The response is well-structured and professional, though the closing could be slightly more formal."
"Hello, my account was charged twice. Could you help me fix that?",We've identified the issue and have requested a refund for the second charge. You should see the funds returned within 5-7 business days.,4.0,"The response correctly addresses the issue of the double charge and provides expected information on the refund timeline, but it lacks a brief apology or expression of empathy.",4.5,"The format is clear and professional, with a structured response, but lacks a greeting or closing which could enhance the overall communication."
I can't log into my account. It says 'invalid password' even though I'm sure it's correct.,Please reset your password using the 'Forgot Password' link. Let us know if you still encounter issues afterwards.,3.5,"Response addresses the main issue by suggesting a password reset, but lacks secondary information like confirming email correctness or checking for caps lock.",5.0,"Response is clear, well-structured with a direct instruction, and grammatically flawless."
